[
  {
    "index": "aasimar",
    "name": "Aasimar",
    "type": "humanoid",
    "family_type": "humanoid",
    "speed": 30,
    "ability_score_increase": {
      "charisma": 2,
      "one_other": 1
    },
    "ability_score_options": [
      {
        "score": "strength",
        "value": 1
      },
      {
        "score": "dexterity",
        "value": 1
      },
      {
        "score": "constitution",
        "value": 1
      },
      {
        "score": "intelligence",
        "value": 1
      },
      {
        "score": "wisdom",
        "value": 1
      }
    ],
    "alignment": "usually lawful good",
    "age": "reach adulthood at 18 and live up to 150 years",
    "size": "medium",
    "size_description": "Aasimar are similar in size and build to humans.",
    "starting_proficiencies": [],
    "starting_proficiency_options": {},
    "languages": [
      "Common",
      "Abyssal"
    ],
    "language_desc": "You can speak, read, and write Common and Abyssal.",
    "language_options": {
      "additional": "One additional language of your choice"
    },
    "traits": [
      {
        "name": "Celestial Resistance",
        "desc": "You have resistance to radiant damage and necrotic damage."
      },
      {
        "name": "Light Bringer",
        "desc": "You know the light cantrip. When you reach 3rd level, you can cast the daylight spell once with this trait and regain the ability to do so when you finish a long rest. Charisma is your spellcasting ability for this spell."
      },
      {
        "name": "Angel's Eyes",
        "desc": "You have darkvision with a range of 60 feet."
      },
      {
        "name": "Celestial Legacy",
        "desc": "When you die, a luminous, winged avatar of your choice appears. The avatar speaks a message from your deity before you are resurrected. This trait can be used only once."
      }
    ],
    "subspecies": [
      {
        "name": "Fallen Aasimar",
        "desc": "Your lineage is tainted by a curse that marks you as an agent of death."
      }
    ],
    "book": "Player's Handbook 2024",
    "desc": "Aasimar are mortals touched by the power of celestial beings.",
    "page": 108,
    "movement_options": []
  },
  {
    "index": "dragonborn",
    "name": "Dragonborn",
    "type": "humanoid",
    "family_type": "humanoid",
    "speed": 30,
    "ability_score_increase": {
      "strength": 2,
      "one_other": 1
    },
    "ability_score_options": [
      {
        "score": "dexterity",
        "value": 1
      },
      {
        "score": "constitution",
        "value": 1
      },
      {
        "score": "intelligence",
        "value": 1
      },
      {
        "score": "wisdom",
        "value": 1
      },
      {
        "score": "charisma",
        "value": 1
      }
    ],
    "alignment": "varies",
    "age": "reach adulthood at 12 and live up to 80 years",
    "size": "medium",
    "size_description": "Dragonborn are taller and heavier than humans, standing between 6 and 7 feet tall and averaging around 250 pounds.",
    "starting_proficiencies": [],
    "starting_proficiency_options": {},
    "languages": [
      "Common",
      "Draconic"
    ],
    "language_desc": "You can speak, read, and write Common and Draconic.",
    "language_options": {
      "additional": "None"
    },
    "traits": [
      {
        "name": "Draconic Ancestry",
        "desc": "You choose a draconic ancestry, which determines your damage resistance and breath weapon."
      },
      {
        "name": "Breath Weapon",
        "desc": "You can exhale destructive energy in a line or cone. The type of damage and the shape of the breath weapon depend on your draconic ancestry."
      },
      {
        "name": "Damage Resistance",
        "desc": "You have resistance to a damage type determined by your draconic ancestry."
      },
      {
        "name": "Dragonborn Legacy",
        "desc": "You know the fire bolt cantrip. Intelligence, Wisdom, or Charisma is your spellcasting ability for this spell (your choice when you gain this trait)."
      }
    ],
    "subspecies": [
      {
        "name": "Gold Dragonborn"
      },
      {
        "name": "Blue Dragonborn"
      },
      {
        "name": "Red Dragonborn"
      },
      {
        "name": "Black Dragonborn"
      },
      {
        "name": "Bronze Dragonborn"
      },
      {
        "name": "Copper Dragonborn"
      },
      {
        "name": "Silver Dragonborn"
      },
      {
        "name": "Brass Dragonborn"
      },
      {
        "name": "White Dragonborn"
      },
      {
        "name": "Green Dragonborn"
      }
    ],
    "book": "Player's Handbook 2024",
    "desc": "Dragonborn are humanoids with the blood of dragons in their veins.",
    "page": 112,
    "movement_options": []
  },
  {
    "index": "dwarf",
    "name": "Dwarf",
    "type": "humanoid",
    "family_type": "clan",
    "speed": 25,
    "ability_score_increase": {
      "constitution": 2,
      "one_other": 1
    },
    "ability_score_options": [
      {
        "score": "strength",
        "value": 1
      },
      {
        "score": "dexterity",
        "value": 1
      },
      {
        "score": "intelligence",
        "value": 1
      },
      {
        "score": "wisdom",
        "value": 1
      },
      {
        "score": "charisma",
        "value": 1
      }
    ],
    "alignment": "usually lawful",
    "age": "reach adulthood at 50 and live up to 350 years",
    "size": "medium",
    "size_description": "Dwarves stand between 4 and 5 feet tall and average about 150 pounds.",
    "starting_proficiencies": [
      "light armor",
      "medium armor",
      "shields",
      "simple weapons",
      "martial weapons"
    ],
    "starting_proficiency_options": {},
    "languages": [
      "Common",
      "Dwarvish"
    ],
    "language_desc": "You can speak, read, and write Common and Dwarvish.",
    "language_options": {},
    "traits": [
      {
        "name": "Dwarven Toughness",
        "desc": "Your hit point maximum increases by 1, and it increases by 1 every time you gain a level."
      },
      {
        "name": "Darkvision",
        "desc": "You can see in dim light within 60 feet of you as if it were bright light, and in darkness as if it were dim light."
      },
      {
        "name": "Dwarven Combat Training",
        "desc": "You have proficiency with the battleaxe, handaxe, light hammer, and warhammer."
      },
      {
        "name": "Tool Proficiency",
        "desc": "You have proficiency with the smith's tools, brewer's supplies, or mason's tools."
      },
      {
        "name": "Stonecunning",
        "desc": "Whenever you make an Intelligence (History) check related to the origin of stonework, you are considered proficient in the History skill and add double your proficiency bonus to the check, instead of your normal proficiency bonus."
      },
      {
        "name": "Dwarven Resilience",
        "desc": "You have advantage on saving throws against poison, and you have resistance against poison damage."
      },
      {
        "name": "Dwarven Weapon Training",
        "desc": "You have proficiency with light and medium armor."
      }
    ],
    "subspecies": [
      {
        "name": "Hill Dwarf",
        "desc": "Hill dwarves have a connection to the earth that grants them additional vitality."
      },
      {
        "name": "Mountain Dwarf",
        "desc": "Mountain dwarves are tough and resilient, forged by life in the harsh mountain terrain."
      }
    ],
    "book": "Player's Handbook 2024",
    "desc": "Dwarves are known for their endurance, stonework, and strong sense of community.",
    "page": 116,
    "movement_options": []
  },
  {
    "index": "elf",
    "name": "Elf",
    "type": "humanoid",
    "family_type": "clan",
    "speed": 30,
    "ability_score_increase": {
      "dexterity": 2,
      "one_other": 1
    },
    "ability_score_options": [
      {
        "score": "strength",
        "value": 1
      },
      {
        "score": "constitution",
        "value": 1
      },
      {
        "score": "intelligence",
        "value": 1
      },
      {
        "score": "wisdom",
        "value": 1
      },
      {
        "score": "charisma",
        "value": 1
      }
    ],
    "alignment": "varies",
    "age": "reach adulthood at 100 and live up to 750 years",
    "size": "medium",
    "size_description": "Elves stand between 5 and 6 feet tall and are slender, weighing about 100 to 150 pounds.",
    "starting_proficiencies": [
      "light armor",
      "simple weapons",
      "martial weapons"
    ],
    "starting_proficiency_options": {},
    "languages": [
      "Common",
      "Elvish"
    ],
    "language_desc": "You can speak, read, and write Common and Elvish.",
    "language_options": {},
    "traits": [
      {
        "name": "Fey Ancestry",
        "desc": "You have advantage on saving throws against being charmed, and magic can't put you to sleep."
      },
      {
        "name": "Trance",
        "desc": "Elves don't need to sleep. Instead, they meditate deeply, remaining semiconscious, for 4 hours a day. (The Common word for this is trance.) While meditating, you can dream after a fashion."
      },
      {
        "name": "Darkvision",
        "desc": "You can see in dim light within 60 feet of you as if it were bright light, and in darkness as if it were dim light."
      },
      {
        "name": "Elf Weapon Training",
        "desc": "You have proficiency with the longsword, shortsword, shortbow, and longbow."
      }
    ],
    "subspecies": [
      {
        "name": "High Elf",
        "desc": "High elves are the most common type of elf in many lands."
      },
      {
        "name": "Wood Elf",
        "desc": "Wood elves are at home in forests and wilderness areas."
      },
      {
        "name": "Drow",
        "desc": "Drow are dark elves who live in the Underdark."
      }
    ],
    "book": "Player's Handbook 2024",